{
  "schema_version": 1,
  "memory_id": "mem_auth_01",
  "project_id": "p_demo",
  "task_id": "BE-014",
  "scope": "domain",
  "domain": "backend",
  "kind": "observation",
  "status": "candidate",
  "content": "Server login response follows frozen AUTH 1.0.0 contract.",
  "source": {
    "kind": "file",
    "reference": "src/server/auth/login.ts",
    "commit": null,
    "line": 20
  },
  "author_session": "s_backend_1",
  "validator": null,
  "supersedes_id": null,
  "content_hash": "bbbbbbbbbbbbbbbbbbbbbbbbbbbbbbbbbbbbbbbbbbbbbbbbbbbbbbbbbbbbbbbb",
  "sensitivity": "internal",
  "created_at": "2026-10-13T14:32:00Z"
}
